ke_id	ke_name	url	detection_method	method_description	reference	method_type
445	Respiratory distress/arrest (KE445)	https://aopwiki.org/events/445	Bronchoconstriction challenge	In humans, airway hyperreactivity is assessed by metacholine challenge, monitoring airway resistance increases after aerosol exposure.	Leikauf	in vivo
445	Respiratory distress/arrest (KE445)	https://aopwiki.org/events/445	Pulmonary edema measurement	Pulmonary edema is quantified by lung wet weight:dry weight ratio or pulmonary lavage fluid analysis in animal studies.	Leikauf	in vivo
445	Respiratory distress/arrest (KE445)	https://aopwiki.org/events/445	Inhalation exposure studies	In vivo animal exposures in inhalation chambers monitor respiratory responses and pathology following controlled toxicant exposure.	Leikauf	in vivo
445	Respiratory distress/arrest (KE445)	https://aopwiki.org/events/445	Histopathology of respiratory tissues	Microscopic and gross examination of respiratory tract (nasal passages, larynx, bronchi, parenchyma) identifies inflammation or structural lesions.	Leikauf	in vivo
445	Respiratory distress/arrest (KE445)	https://aopwiki.org/events/445	Isolated lung and airway assays	Perfused lung preparations, airway microdissection, and lung tissue culture provide in vitro systems for functional and structural evaluation.	Leikauf	in vitro
1963	Torsades de Pointes (KE1963)	https://aopwiki.org/events/1963	NA	NA	NA	NA
2000	Vascular calcification (KE2000)	https://aopwiki.org/events/2000	NA	NA	NA	NA
2003	Vascular remodeling (KE2003)	https://aopwiki.org/events/2003	NA	NA	NA	NA
2002	Ventricular remodeling (KE2002)	https://aopwiki.org/events/2002	NA	NA	NA	NA